{
  "admission_state": "PENDING_INDEPENDENT_REVIEW",
  "body": {
    "admitted": false,
    "artifact_manifest": [
      {
        "bytes": 1841,
        "media_type": "application/json",
        "name": "github-security-coverage-receipt.json",
        "sha256": "39d2e67e4707ca5d816066d747baef72b41ed639df94b49abd33358d16e4b7e6"
      },
      {
        "bytes": 3490,
        "media_type": "application/json",
        "name": "portfolio-truth-0.11.0.json",
        "sha256": "dda555e89bd78f085beaeecd61fb93b6448b2a4cfde1a0e175ff06fc09daa504"
      }
    ],
    "automated_checks": {
      "consumer_visible_label_absence": "PASS",
      "decoded_secret_privacy": "PASS",
      "full_contract_shape": "PASS",
      "reserved_synthetic_identity": "PASS",
      "semantic_locality": "PASS"
    },
    "consumer_invoked": false,
    "expected_ceiling": {
      "authority_ceiling": "NONAUTHORITATIVE",
      "disposition": "MASKED",
      "raw_signal": {
        "coverage_state": "unknown",
        "reason": "required_count_redacted"
      },
      "reason_family": "required_count_redacted",
      "source": "sealed-contract-adjudication-not-consumer-output"
    },
    "fixture_id": "P1-03",
    "fixture_schema": "P1FullFixtureV2",
    "independent_review": "PENDING_INDEPENDENT_REVIEW",
    "kind": "primary-mutation",
    "path_id": "P1",
    "semantic_axis": "visible"
  },
  "candidate_state": "READY_FOR_INDEPENDENT_REVIEW",
  "content_sha256": "0fc7ff0736d4148dba04869620641ee4173e20f1d9093521993a97f3bb17062f",
  "created_at": "2026-07-31T21:27:04Z",
  "package_id": "20260731-evidence-conservation-v2",
  "prerequisite_state": "PENDING",
  "producer": {
    "actor_id": "codex",
    "role": "EVIDENCE_PACKAGE_GENERATOR"
  },
  "record_id": "fixture-admissibility-p1-03-v1",
  "reviews": [],
  "schema": "FixtureAdmissibilityV1",
  "spec_sha256": "f6f882740f5f4285fb5910ffd963cb7a74af9d67522375d4eef891f25eaf1121"
}
