{
  "admission_state": "PENDING_INDEPENDENT_REVIEW",
  "body": {
    "admitted": false,
    "artifact_manifest": [
      {
        "bytes": 531,
        "media_type": "application/json",
        "name": "engine-result.json",
        "sha256": "9f86ee405b08b1a4588bf7f5d87e8bf4e0e8785ddbc733d5e64ec2f8ad3bbef9"
      },
      {
        "bytes": 40960,
        "media_type": "application/x-tar",
        "name": "refresh-candidate.tar",
        "sha256": "a6aec2aa48e497aa33e450984ec70bd518920fca8f87059357d72ab6c62cd5de"
      }
    ],
    "automated_checks": {
      "consumer_visible_label_absence": "PASS",
      "decoded_secret_privacy": "PASS",
      "full_contract_shape": "PASS",
      "reserved_synthetic_identity": "PASS",
      "semantic_locality": "PASS"
    },
    "consumer_invoked": false,
    "expected_ceiling": {
      "authority_ceiling": "BLOCKED",
      "disposition": "CONTRADICTORY",
      "raw_signal": {
        "error": "fresh_grade_binding_mismatch"
      },
      "reason_family": "fresh_grade_binding_mismatch",
      "source": "sealed-contract-adjudication-not-consumer-output"
    },
    "fixture_id": "P2-04",
    "fixture_schema": "P2FullFixtureV2",
    "independent_review": "PENDING_INDEPENDENT_REVIEW",
    "kind": "primary-mutation",
    "path_id": "P2",
    "semantic_axis": "consistent"
  },
  "candidate_state": "READY_FOR_INDEPENDENT_REVIEW",
  "content_sha256": "dbe4ec41bb82dc09f169931caeaed5929d7b3961a03bc4a8dddf13ec703a94b7",
  "created_at": "2026-07-31T21:27:04Z",
  "package_id": "20260731-evidence-conservation-v2",
  "prerequisite_state": "PENDING",
  "producer": {
    "actor_id": "codex",
    "role": "EVIDENCE_PACKAGE_GENERATOR"
  },
  "record_id": "fixture-admissibility-p2-04-v1",
  "reviews": [],
  "schema": "FixtureAdmissibilityV1",
  "spec_sha256": "1b23e6220d228a170a964c0e889d3d2fecd4ddc9ae4c46a73d8b13f927ed0c74"
}
