{
  "admission_state": "PENDING_INDEPENDENT_REVIEW",
  "body": {
    "admitted": false,
    "artifact_manifest": [
      {
        "bytes": 531,
        "media_type": "application/json",
        "name": "engine-result.json",
        "sha256": "9f86ee405b08b1a4588bf7f5d87e8bf4e0e8785ddbc733d5e64ec2f8ad3bbef9"
      },
      {
        "bytes": 40960,
        "media_type": "application/x-tar",
        "name": "refresh-candidate.tar",
        "sha256": "f63e48116c249c3bd16c2122293fccbca5c4b64fe2c37d721e426af5fbe327a4"
      }
    ],
    "automated_checks": {
      "consumer_visible_label_absence": "PASS",
      "decoded_secret_privacy": "PASS",
      "full_contract_shape": "PASS",
      "reserved_synthetic_identity": "PASS",
      "semantic_locality": "PASS"
    },
    "consumer_invoked": false,
    "expected_ceiling": {
      "authority_ceiling": "BLOCKED",
      "disposition": "UNSUPPORTED",
      "raw_signal": {
        "error": "successful_scan_receipt_schema_invalid"
      },
      "reason_family": "successful_scan_receipt_schema_invalid",
      "source": "sealed-contract-adjudication-not-consumer-output"
    },
    "fixture_id": "P2-05",
    "fixture_schema": "P2FullFixtureV2",
    "independent_review": "PENDING_INDEPENDENT_REVIEW",
    "kind": "primary-mutation",
    "path_id": "P2",
    "semantic_axis": "supported"
  },
  "candidate_state": "READY_FOR_INDEPENDENT_REVIEW",
  "content_sha256": "57301374187f80001e0862bdb9f893cd18f22051029d078121ad671a50e8ac16",
  "created_at": "2026-07-31T21:27:04Z",
  "package_id": "20260731-evidence-conservation-v2",
  "prerequisite_state": "PENDING",
  "producer": {
    "actor_id": "codex",
    "role": "EVIDENCE_PACKAGE_GENERATOR"
  },
  "record_id": "fixture-admissibility-p2-05-v1",
  "reviews": [],
  "schema": "FixtureAdmissibilityV1",
  "spec_sha256": "1b23e6220d228a170a964c0e889d3d2fecd4ddc9ae4c46a73d8b13f927ed0c74"
}
