{
  "admission_state": "PENDING_INDEPENDENT_REVIEW",
  "body": {
    "admitted": false,
    "artifact_manifest": [
      {
        "bytes": 531,
        "media_type": "application/json",
        "name": "engine-result.json",
        "sha256": "9f86ee405b08b1a4588bf7f5d87e8bf4e0e8785ddbc733d5e64ec2f8ad3bbef9"
      },
      {
        "bytes": 40960,
        "media_type": "application/x-tar",
        "name": "refresh-candidate.tar",
        "sha256": "fc26e63826a80c0cd85ce5c5149355e9fec685bbf939d193eb50326fa1746291"
      }
    ],
    "automated_checks": {
      "consumer_visible_label_absence": "PASS",
      "decoded_secret_privacy": "PASS",
      "full_contract_shape": "PASS",
      "reserved_synthetic_identity": "PASS",
      "semantic_locality": "PASS"
    },
    "consumer_invoked": false,
    "expected_ceiling": {
      "authority_ceiling": "NONAUTHORITATIVE",
      "disposition": "MASKED",
      "raw_signal": {
        "grade_visibility": "withheld",
        "result_state": "masked"
      },
      "reason_family": "masked",
      "source": "sealed-contract-adjudication-not-consumer-output"
    },
    "fixture_id": "P2-03",
    "fixture_schema": "P2FullFixtureV2",
    "independent_review": "PENDING_INDEPENDENT_REVIEW",
    "kind": "primary-mutation",
    "path_id": "P2",
    "semantic_axis": "visible"
  },
  "candidate_state": "READY_FOR_INDEPENDENT_REVIEW",
  "content_sha256": "522de405980fb05c28224acaa9b21974ca0acc916f4df0778527aa659dac45f7",
  "created_at": "2026-07-31T21:27:04Z",
  "package_id": "20260731-evidence-conservation-v2",
  "prerequisite_state": "PENDING",
  "producer": {
    "actor_id": "codex",
    "role": "EVIDENCE_PACKAGE_GENERATOR"
  },
  "record_id": "fixture-admissibility-p2-03-v1",
  "reviews": [],
  "schema": "FixtureAdmissibilityV1",
  "spec_sha256": "f6f882740f5f4285fb5910ffd963cb7a74af9d67522375d4eef891f25eaf1121"
}
