{
  "admission_state": "PENDING_INDEPENDENT_REVIEW",
  "body": {
    "admitted": false,
    "artifact_manifest": [
      {
        "bytes": 1832,
        "media_type": "application/json",
        "name": "github-security-coverage-receipt.json",
        "sha256": "bd2b3a6d1a12799a6b489fe1fada0c2ea06840cdc5101c3ca0618dc3963c5c42"
      },
      {
        "bytes": 3473,
        "media_type": "application/json",
        "name": "portfolio-truth-0.11.0.json",
        "sha256": "52e3b72a4de3d44bf7021c7a175ee85b7749ab88c613ca18d18954c7191d47f1"
      }
    ],
    "automated_checks": {
      "consumer_visible_label_absence": "PASS",
      "decoded_secret_privacy": "PASS",
      "full_contract_shape": "PASS",
      "reserved_synthetic_identity": "PASS",
      "semantic_locality": "PASS"
    },
    "consumer_invoked": false,
    "expected_ceiling": {
      "authority_ceiling": "STRONG",
      "disposition": "VALID",
      "raw_signal": {
        "coverage_state": "complete",
        "overall": "COMPLETE"
      },
      "reason_family": "complete",
      "source": "sealed-contract-adjudication-not-consumer-output"
    },
    "fixture_id": "P1-C",
    "fixture_schema": "P1FullFixtureV2",
    "independent_review": "PENDING_INDEPENDENT_REVIEW",
    "kind": "control",
    "path_id": "P1",
    "semantic_axis": "control"
  },
  "candidate_state": "READY_FOR_INDEPENDENT_REVIEW",
  "content_sha256": "9b9128af59033fc2586f269c6e78a0d1f3c1dea5fb6774f9c350d9a26384303e",
  "created_at": "2026-07-31T21:27:04Z",
  "package_id": "20260731-evidence-conservation-v2",
  "prerequisite_state": "PENDING",
  "producer": {
    "actor_id": "codex",
    "role": "EVIDENCE_PACKAGE_GENERATOR"
  },
  "record_id": "fixture-admissibility-p1-control-v1",
  "reviews": [],
  "schema": "FixtureAdmissibilityV1",
  "spec_sha256": "1b23e6220d228a170a964c0e889d3d2fecd4ddc9ae4c46a73d8b13f927ed0c74"
}
