{
  "admission_state": "PENDING_INDEPENDENT_REVIEW",
  "body": {
    "admitted": false,
    "artifact_manifest": [
      {
        "bytes": 531,
        "media_type": "application/json",
        "name": "engine-result.json",
        "sha256": "9f86ee405b08b1a4588bf7f5d87e8bf4e0e8785ddbc733d5e64ec2f8ad3bbef9"
      },
      {
        "bytes": 40960,
        "media_type": "application/x-tar",
        "name": "refresh-candidate.tar",
        "sha256": "250991bf1c9148f6137ff94144d594bee1729572095094004e04d835d00a7bd8"
      }
    ],
    "automated_checks": {
      "consumer_visible_label_absence": "PASS",
      "decoded_secret_privacy": "PASS",
      "full_contract_shape": "PASS",
      "reserved_synthetic_identity": "PASS",
      "semantic_locality": "PASS"
    },
    "consumer_invoked": false,
    "expected_ceiling": {
      "authority_ceiling": "STRONG",
      "disposition": "VALID",
      "raw_signal": {
        "publication_ready": false,
        "state": "fixture",
        "structural_valid": true
      },
      "reason_family": "fixture_candidate_valid",
      "source": "sealed-contract-adjudication-not-consumer-output"
    },
    "fixture_id": "P2-C",
    "fixture_schema": "P2FullFixtureV2",
    "independent_review": "PENDING_INDEPENDENT_REVIEW",
    "kind": "control",
    "path_id": "P2",
    "semantic_axis": "control"
  },
  "candidate_state": "READY_FOR_INDEPENDENT_REVIEW",
  "content_sha256": "2b078c38bbace334535957b0d81faba8152d95c1b19d97b747c6d987f9db2f3d",
  "created_at": "2026-07-31T21:27:04Z",
  "package_id": "20260731-evidence-conservation-v2",
  "prerequisite_state": "PENDING",
  "producer": {
    "actor_id": "codex",
    "role": "EVIDENCE_PACKAGE_GENERATOR"
  },
  "record_id": "fixture-admissibility-p2-control-v1",
  "reviews": [],
  "schema": "FixtureAdmissibilityV1",
  "spec_sha256": "f6f882740f5f4285fb5910ffd963cb7a74af9d67522375d4eef891f25eaf1121"
}
