{
  "admission_state": "PENDING_INDEPENDENT_REVIEW",
  "body": {
    "admitted": false,
    "artifact_manifest": [
      {
        "bytes": 1510,
        "media_type": "application/json",
        "name": "github-security-coverage-receipt.json",
        "sha256": "2115b4aadeb6bd03659904a5150149cffe48df815c6acbe42aa805fc7215cfcf"
      },
      {
        "bytes": 3343,
        "media_type": "application/json",
        "name": "portfolio-truth-0.11.0.json",
        "sha256": "5b76255ccfd3f1910cf255c7f51c1613c1330f2c88321e9955e888c8cc36385a"
      }
    ],
    "automated_checks": {
      "consumer_visible_label_absence": "PASS",
      "decoded_secret_privacy": "PASS",
      "full_contract_shape": "PASS",
      "reserved_synthetic_identity": "PASS",
      "semantic_locality": "PASS"
    },
    "consumer_invoked": false,
    "expected_ceiling": {
      "authority_ceiling": "NONAUTHORITATIVE",
      "disposition": "MISSING",
      "raw_signal": {
        "coverage_state": "unknown",
        "reason": "required_provider_missing"
      },
      "reason_family": "required_provider_missing",
      "source": "sealed-contract-adjudication-not-consumer-output"
    },
    "fixture_id": "P1-01",
    "fixture_schema": "P1FullFixtureV2",
    "independent_review": "PENDING_INDEPENDENT_REVIEW",
    "kind": "primary-mutation",
    "path_id": "P1",
    "semantic_axis": "present"
  },
  "candidate_state": "READY_FOR_INDEPENDENT_REVIEW",
  "content_sha256": "64c5b02de5a12c972380722e504e55bbc28699b13330a30d1f966ac4c6aa0f3e",
  "created_at": "2026-07-31T21:27:04Z",
  "package_id": "20260731-evidence-conservation-v2",
  "prerequisite_state": "PENDING",
  "producer": {
    "actor_id": "codex",
    "role": "EVIDENCE_PACKAGE_GENERATOR"
  },
  "record_id": "fixture-admissibility-p1-01-v1",
  "reviews": [],
  "schema": "FixtureAdmissibilityV1",
  "spec_sha256": "f6f882740f5f4285fb5910ffd963cb7a74af9d67522375d4eef891f25eaf1121"
}
