{
  "admission_state": "PENDING_INDEPENDENT_REVIEW",
  "body": {
    "admitted": false,
    "artifact_manifest": [
      {
        "bytes": 1833,
        "media_type": "application/json",
        "name": "github-security-coverage-receipt.json",
        "sha256": "39e10c1333c42c10392f1de78b5501089830fdc951a1659e5084f9838d7ddaa2"
      },
      {
        "bytes": 3474,
        "media_type": "application/json",
        "name": "portfolio-truth-0.11.0.json",
        "sha256": "d3948ea813f5fd4332468f8d12dbd338ab629f05b666a3bd75d7113f74edc791"
      }
    ],
    "automated_checks": {
      "consumer_visible_label_absence": "PASS",
      "decoded_secret_privacy": "PASS",
      "full_contract_shape": "PASS",
      "reserved_synthetic_identity": "PASS",
      "semantic_locality": "PASS"
    },
    "consumer_invoked": false,
    "expected_ceiling": {
      "authority_ceiling": "NONAUTHORITATIVE",
      "disposition": "CONTRADICTORY",
      "raw_signal": {
        "coverage_state": "unknown",
        "reason": "pagination_incomplete"
      },
      "reason_family": "pagination_incomplete",
      "source": "sealed-contract-adjudication-not-consumer-output"
    },
    "fixture_id": "P1-04",
    "fixture_schema": "P1FullFixtureV2",
    "independent_review": "PENDING_INDEPENDENT_REVIEW",
    "kind": "primary-mutation",
    "path_id": "P1",
    "semantic_axis": "consistent"
  },
  "candidate_state": "READY_FOR_INDEPENDENT_REVIEW",
  "content_sha256": "5edd84173f8c178aa053cbe8ff44fe76b358f62ed8d1c8c36c847587675adbd9",
  "created_at": "2026-07-31T21:27:04Z",
  "package_id": "20260731-evidence-conservation-v2",
  "prerequisite_state": "PENDING",
  "producer": {
    "actor_id": "codex",
    "role": "EVIDENCE_PACKAGE_GENERATOR"
  },
  "record_id": "fixture-admissibility-p1-04-v1",
  "reviews": [],
  "schema": "FixtureAdmissibilityV1",
  "spec_sha256": "f6f882740f5f4285fb5910ffd963cb7a74af9d67522375d4eef891f25eaf1121"
}
