{
  "admission_state": "PENDING_INDEPENDENT_REVIEW",
  "body": {
    "admitted": false,
    "artifact_manifest": [
      {
        "bytes": 531,
        "media_type": "application/json",
        "name": "engine-result.json",
        "sha256": "9f86ee405b08b1a4588bf7f5d87e8bf4e0e8785ddbc733d5e64ec2f8ad3bbef9"
      },
      {
        "bytes": 40960,
        "media_type": "application/x-tar",
        "name": "refresh-candidate.tar",
        "sha256": "f9e5c8138c48b43fb84457adf8fae942d532d487edf8bcce618f898905ae8ce1"
      }
    ],
    "automated_checks": {
      "consumer_visible_label_absence": "PASS",
      "decoded_secret_privacy": "PASS",
      "full_contract_shape": "PASS",
      "reserved_synthetic_identity": "PASS",
      "semantic_locality": "PASS"
    },
    "consumer_invoked": false,
    "expected_ceiling": {
      "authority_ceiling": "BLOCKED",
      "disposition": "MISBOUND",
      "raw_signal": {
        "error": "receipt_scan_binding_mismatch"
      },
      "reason_family": "receipt_scan_binding_mismatch",
      "source": "sealed-contract-adjudication-not-consumer-output"
    },
    "fixture_id": "P2-06",
    "fixture_schema": "P2FullFixtureV2",
    "independent_review": "PENDING_INDEPENDENT_REVIEW",
    "kind": "primary-mutation",
    "path_id": "P2",
    "semantic_axis": "bound"
  },
  "candidate_state": "READY_FOR_INDEPENDENT_REVIEW",
  "content_sha256": "e21fbf8d3ea8ba95513e4d79e4f6e3012071236841676926b52a9c32f1565a1c",
  "created_at": "2026-07-31T21:27:04Z",
  "package_id": "20260731-evidence-conservation-v2",
  "prerequisite_state": "PENDING",
  "producer": {
    "actor_id": "codex",
    "role": "EVIDENCE_PACKAGE_GENERATOR"
  },
  "record_id": "fixture-admissibility-p2-06-v1",
  "reviews": [],
  "schema": "FixtureAdmissibilityV1",
  "spec_sha256": "1b23e6220d228a170a964c0e889d3d2fecd4ddc9ae4c46a73d8b13f927ed0c74"
}
