{
  "admission_state": "PENDING_INDEPENDENT_REVIEW",
  "body": {
    "admitted": false,
    "artifact_manifest": [
      {
        "bytes": 176128,
        "media_type": "application/vnd.sqlite3",
        "name": "source.sqlite",
        "sha256": "0f2b455367a94efa5ad11f08bfce49c39175596c5a9e6f0e566530dd9ed504da"
      },
      {
        "bytes": 184320,
        "media_type": "application/x-tar",
        "name": "recovery-anchor.tar",
        "sha256": "1132d70dcad6e600725efd7ded5503a451b292af3b9fa284bd7251f43d6bef91"
      }
    ],
    "automated_checks": {
      "consumer_visible_label_absence": "PASS",
      "decoded_secret_privacy": "PASS",
      "full_contract_shape": "PASS",
      "reserved_synthetic_identity": "PASS",
      "semantic_locality": "PASS"
    },
    "consumer_invoked": false,
    "ctime": [
      {
        "classification": "UNAVOIDABLE_EXCLUDED",
        "effect": "inode_ctime_changes_when_mode_is_materialized",
        "oracle_visibility": "ABSENT",
        "timing": "completed_before_verification"
      }
    ],
    "expected_ceiling": {
      "authority_ceiling": "BLOCKED",
      "disposition": "NOT_PRIVATE",
      "raw_signal": {
        "digest_ok": true,
        "errors": [
          "backup_permissions_not_private"
        ],
        "expected_schema_version": 22,
        "integrity_ok": true,
        "permissions": "not_private",
        "ready": false,
        "recovery_readback": "unverified",
        "schema_version": 22,
        "semantic_readback_ok": true,
        "source_current": "ABSENT",
        "state": "invalid"
      },
      "reason_family": "backup_permissions_not_private",
      "source": "sealed-contract-adjudication-not-consumer-output"
    },
    "fixture_id": "P3-06",
    "fixture_schema": "P3FullFixtureV2",
    "independent_review": "PENDING_INDEPENDENT_REVIEW",
    "kind": "primary-mutation",
    "path_id": "P3",
    "posix_precondition": {
      "mode_0600_observed": "0600",
      "mode_0644_observed": "0644",
      "status": "PASS",
      "unsupported_action": "ABORT_NO_EMULATION"
    },
    "semantic_axis": "private"
  },
  "candidate_state": "READY_FOR_INDEPENDENT_REVIEW",
  "content_sha256": "a467d3dddf98c367585d6102fb9e6a78c76914dd428a986fbc55a89d25dbb55a",
  "created_at": "2026-07-31T21:27:04Z",
  "package_id": "20260731-evidence-conservation-v2",
  "prerequisite_state": "PENDING",
  "producer": {
    "actor_id": "codex",
    "role": "EVIDENCE_PACKAGE_GENERATOR"
  },
  "record_id": "fixture-admissibility-p3-06-v1",
  "reviews": [],
  "schema": "FixtureAdmissibilityV1",
  "spec_sha256": "1b23e6220d228a170a964c0e889d3d2fecd4ddc9ae4c46a73d8b13f927ed0c74"
}
