{
  "admission_state": "PENDING_INDEPENDENT_REVIEW",
  "body": {
    "admitted": false,
    "artifact_manifest": [
      {
        "bytes": 176128,
        "media_type": "application/vnd.sqlite3",
        "name": "source.sqlite",
        "sha256": "0f2b455367a94efa5ad11f08bfce49c39175596c5a9e6f0e566530dd9ed504da"
      },
      {
        "bytes": 184320,
        "media_type": "application/x-tar",
        "name": "recovery-anchor.tar",
        "sha256": "7b36bb1513da2320446040e231654038b5ddbb23321d81599e26a2a957a86bc6"
      }
    ],
    "automated_checks": {
      "consumer_visible_label_absence": "PASS",
      "decoded_secret_privacy": "PASS",
      "full_contract_shape": "PASS",
      "reserved_synthetic_identity": "PASS",
      "semantic_locality": "PASS"
    },
    "consumer_invoked": false,
    "expected_ceiling": {
      "authority_ceiling": "BLOCKED",
      "disposition": "CONTRADICTORY",
      "raw_signal": {
        "errors": [
          "byte_size_mismatch"
        ],
        "ready": false,
        "state": "invalid"
      },
      "reason_family": "byte_size_mismatch",
      "source": "sealed-contract-adjudication-not-consumer-output"
    },
    "fixture_id": "P3-04",
    "fixture_schema": "P3FullFixtureV2",
    "independent_review": "PENDING_INDEPENDENT_REVIEW",
    "kind": "primary-mutation",
    "path_id": "P3",
    "semantic_axis": "consistent"
  },
  "candidate_state": "READY_FOR_INDEPENDENT_REVIEW",
  "content_sha256": "858550abcc6323b7f33a37ec4063f3af47b7a64577154865abb8f63548abb996",
  "created_at": "2026-07-31T21:27:04Z",
  "package_id": "20260731-evidence-conservation-v2",
  "prerequisite_state": "PENDING",
  "producer": {
    "actor_id": "codex",
    "role": "EVIDENCE_PACKAGE_GENERATOR"
  },
  "record_id": "fixture-admissibility-p3-04-v1",
  "reviews": [],
  "schema": "FixtureAdmissibilityV1",
  "spec_sha256": "f6f882740f5f4285fb5910ffd963cb7a74af9d67522375d4eef891f25eaf1121"
}
